{
  "prefix": "azure",
  "width": 24,
  "height": 24,
  "icons": {
    "app-service": {
      "body": "<path d=\"M12 2C6.48 2 2 6.48 2 12s4.48 10 10 10 10-4.48 10-10S17.52 2 12 2z\"/>"
    },
    "database": {
      "body": "<path d=\"M12 3C7.58 3 4 4.79 4 7s3.58 4 8 4 8-1.79 8-4-3.58-4-8-4z\"/>"
    }
  }
}
