{
  "prefix": "mdi",
  "width": 24,
  "height": 24,
  "icons": {
    "server": {
      "body": "<path d=\"M4 1h16a1 1 0 0 1 1 1v4a1 1 0 0 1-1 1H4a1 1 0 0 1-1-1V2a1 1 0 0 1 1-1z\"/>"
    },
    "database": {
      "body": "<path d=\"M12 3C7 3 3 4.79 3 7v10c0 2.21 4 4 9 4s9-1.79 9-4V7c0-2.21-4-4-9-4z\"/>"
    }
  }
}
