{
  "prefix": "mdi",
  "icons": {
    "server": {
      "body": "<rect fill=\"currentColor\" x=\"2\" y=\"2\" width=\"20\" height=\"8\" rx=\"2\"/><rect fill=\"currentColor\" x=\"2\" y=\"14\" width=\"20\" height=\"8\" rx=\"2\"/><circle fill=\"none\" stroke=\"currentColor\" stroke-width=\"1.5\" cx=\"19\" cy=\"6\" r=\"1\"/><circle fill=\"none\" stroke=\"currentColor\" stroke-width=\"1.5\" cx=\"19\" cy=\"18\" r=\"1\"/>"
    },
    "database": {
      "body": "<ellipse fill=\"currentColor\" cx=\"12\" cy=\"5\" rx=\"9\" ry=\"3\"/><path fill=\"currentColor\" d=\"M3 5v4c0 1.66 4.03 3 9 3s9-1.34 9-3V5\"/><path fill=\"currentColor\" d=\"M3 9v4c0 1.66 4.03 3 9 3s9-1.34 9-3V9\"/><path fill=\"currentColor\" d=\"M3 13v4c0 1.66 4.03 3 9 3s9-1.34 9-3v-4\"/>"
    }
  },
  "width": 24,
  "height": 24,
  "left": 0,
  "top": 0
}
