{
  "prefix": "lucide",
  "width": 24,
  "height": 24,
  "icons": {
    "box": {
      "body": "<path d=\"M21 16V8a2 2 0 0 0-1-1.73l-7-4a2 2 0 0 0-2 0l-7 4A2 2 0 0 0 3 8v8a2 2 0 0 0 1 1.73l7 4a2 2 0 0 0 2 0l7-4A2 2 0 0 0 21 16z\"/>"
    },
    "cloud": {
      "body": "<path d=\"M18 10h-1.26A8 8 0 1 0 9 20h9a5 5 0 0 0 0-10z\"/>"
    }
  }
}
